Plugin ID,CVE,CVSS v3.0 Base Score,Risk,Host,Protocol,Port,Name
108797,,10.0,Critical,10.0.2.3,tcp,0,Unsupported Windows OS (remote)
53514,CVE-2011-0657,10.0,Critical,10.0.2.3,tcp,53,MS11-030: Vulnerability in DNS Resolution Could Allow Remote Code Execution (2509553) (remote check)
97833,CVE-2017-0144,8.8,High,10.0.2.3,tcp,445,MS17-010: Security Update for Microsoft Windows SMB Server (4013389) (ETERNALBLUE) (WannaCry)
57608,,5.3,Medium,10.0.2.3,tcp,445,SMB Signing not required
10114,CVE-1999-0524,2.1,Low,10.0.2.3,icmp,0,ICMP Timestamp Request Remote Date Disclosure
